{
  "schema_version": "1.0.0",
  "audit_id": "MF-GOV-WP00",
  "reviewed_at": "2026-08-05",
  "active_campaigns": [
    {
      "campaign_id": "UC-001",
      "title": "Union-Closed Sets provider coverage",
      "disposition": "manifest",
      "manifest_path": "provider_manifests/UC-001.json"
    },
    {
      "campaign_id": "NS-CI-001",
      "title": "Critical Navier-Stokes integrability provider coverage",
      "disposition": "manifest",
      "manifest_path": "provider_manifests/NS-CI-001.json"
    },
    {
      "campaign_id": "HC-001",
      "title": "Hodge conjecture provider coverage",
      "disposition": "manifest",
      "manifest_path": "provider_manifests/HC-001.json"
    },
    {
      "campaign_id": "BSD-001",
      "title": "Birch-Swinnerton-Dyer provider coverage",
      "disposition": "manifest",
      "manifest_path": "provider_manifests/BSD-001.json"
    },
    {
      "campaign_id": "PNP-001",
      "title": "P versus NP provider coverage",
      "disposition": "manifest",
      "manifest_path": "provider_manifests/PNP-001.json"
    },
    {
      "campaign_id": "RH-001",
      "title": "Riemann Hypothesis provider coverage",
      "disposition": "manifest",
      "manifest_path": "provider_manifests/RH-001.json"
    },
    {
      "campaign_id": "YM-001",
      "title": "Yang-Mills existence and mass-gap provider coverage",
      "disposition": "manifest",
      "manifest_path": "provider_manifests/YM-001.json"
    },
    {
      "campaign_id": "OZ-001",
      "title": "Odd zeta irrationality provider coverage",
      "disposition": "manifest",
      "manifest_path": "provider_manifests/OZ-001.json"
    }
  ],
  "candidate_campaigns": [
    {
      "campaign_id": "VGSE-001",
      "title": "Varchenko-Galashin structural enumeration candidate provider coverage",
      "lifecycle": "candidate",
      "disposition": "manifest",
      "manifest_path": "provider_manifests/VGSE-001.json"
    },
    {
      "campaign_id": "OPENAI-TEN-PROOFS-001",
      "title": "OpenAI Selected Proofs external formalization candidate provider coverage",
      "lifecycle": "candidate",
      "disposition": "manifest",
      "manifest_path": "provider_manifests/OPENAI-TEN-PROOFS-001.json"
    },
    {
      "campaign_id": "NSOF-001",
      "title": "Nonsofic-groups official source and screenshot-concordance candidate provider coverage",
      "lifecycle": "candidate",
      "disposition": "manifest",
      "manifest_path": "provider_manifests/NSOF-001.json"
    },
    {
      "campaign_id": "EUCLID-GCD-E2E-001",
      "title": "Euclidean algorithm and Bézout witness end-to-end exemplar",
      "lifecycle": "candidate",
      "disposition": "manifest",
      "manifest_path": "provider_manifests/EUCLID-GCD-E2E-001.json"
    },
    {
      "campaign_id": "EUCLID-DIOPHANTINE-E2E-002",
      "title": "Linear Diophantine solvability end-to-end extension",
      "lifecycle": "candidate",
      "disposition": "manifest",
      "manifest_path": "provider_manifests/EUCLID-DIOPHANTINE-E2E-002.json"
    },
    {
      "campaign_id": "EUCLID-ELEMENTS-BOOK-VII-MICRO-001",
      "title": "Heath 1908 Book VII exact-byte source lock and bounded concordance",
      "lifecycle": "candidate",
      "disposition": "manifest",
      "manifest_path": "provider_manifests/EUCLID-ELEMENTS-BOOK-VII-MICRO-001.json"
    },
    {
      "campaign_id": "OPENMATH-2026",
      "title": "OpenMath 2026 seven-hill sprint candidate provider coverage",
      "lifecycle": "candidate",
      "disposition": "manifest",
      "manifest_path": "provider_manifests/OPENMATH-2026.json"
    }
  ]
}
